{"schema_version":1,"run_id":"gist-prq16x2x8","representation":{"kind":"direct_unit_edge"},"codec":{"kind":"prq","nsplits":16,"stages_per_split":2,"nbits":8,"layout":"split_stage_codes"},"correction":{"kind":"none"},"policy":{"kind":"scaled_threshold","alphas":[0.8,0.9,1.0,1.1]},"capture":{"dimension":960,"k":10,"ef":100},"trainer":{"provider":"faiss","seed":20260924,"iterations":12,"sample_cap":20000,"encode_batch_size":4096,"threads":1,"beam_size":5},"query_lifecycle":{"query":"eager_additive_lut","source":"lazy_first_eligible"},"timing":{"mode":"ordered_estimator","blocks":5,"repeats":5,"warmup_passes":1,"thread_count":1,"isa_profile":"portable"}}
