{"schema_version":1,"run_id":"gist-rabitq-1bit","representation":{"kind":"rotated_unit_edge"},"codec":{"kind":"rabitq","nbits":1,"query_bits":0,"centroid":"zero","layout":"faiss_rabitq_code"},"correction":{"kind":"faiss_native_factors"},"policy":{"kind":"scaled_threshold","alphas":[0.8,0.9,1.0,1.1]},"capture":{"dimension":960,"k":10,"ef":100},"trainer":{"provider":"faiss","seed":20260924,"rotation_seed":1234,"sample_cap":20000,"encode_batch_size":4096,"threads":1},"query_lifecycle":{"query":"eager_rotation","source":"lazy_first_eligible"},"timing":{"mode":"ordered_estimator","blocks":5,"repeats":5,"warmup_passes":1,"thread_count":1,"isa_profile":"portable"}}
