{"schema_version":1,"run_id":"gist-opq32x8","representation":{"kind":"rotated_unit_edge"},"codec":{"kind":"opq","m":32,"nbits":8,"layout":"packed_nbits"},"correction":{"kind":"none"},"policy":{"kind":"scaled_threshold","alphas":[0.8,0.9,1.0,1.1]},"capture":{"dimension":960,"k":10,"ef":100},"trainer":{"provider":"faiss","seed":20260924,"iterations":12,"sample_cap":20000,"encode_batch_size":4096,"threads":1},"query_lifecycle":{"query":"eager_rotation_and_lut","source":"lazy_first_eligible"},"timing":{"mode":"ordered_estimator","blocks":5,"repeats":5,"warmup_passes":1,"thread_count":1,"isa_profile":"portable"}}
