{
  "schema_version": 1,
  "run_id": "gist-static-v1",
  "representation": {"kind": "direct_unit_edge"},
  "codec": {"kind": "pq_packed", "m": 64, "nbits": 4, "layout": "packed4"},
  "correction": {"kind": "none"},
  "policy": {"kind": "scaled_threshold", "alphas": [0.8, 0.9, 1.0, 1.1]},
  "capture": {"dimension": 960, "k": 10, "ef": 100},
  "trainer": {"seed": 20260924, "iterations": 12, "sample_cap": 20000},
  "query_lifecycle": {"query": "eager", "source": "lazy_first_eligible"},
  "timing": {"mode": "ordered_estimator", "blocks": 5, "repeats": 5,
             "warmup_passes": 1, "thread_count": 1, "isa_profile": "portable"}
}
